{
  "systems": [
    {
      "index": 0,
      "bounding_box": {
        "x_position": 0,
        "y_position": 0,
        "width": 1200,
        "height": 200
      },
      "staff_groups": [
        {
          "instrument_id": "violin-1",
          "staves": [
            {
              "staff_lines": [
                { "y_position": 0, "start_x": 0, "end_x": 1200 },
                { "y_position": 5, "start_x": 0, "end_x": 1200 },
                { "y_position": 10, "start_x": 0, "end_x": 1200 },
                { "y_position": 15, "start_x": 0, "end_x": 1200 },
                { "y_position": 20, "start_x": 0, "end_x": 1200 }
              ],
              "glyph_runs": [
                {
                  "glyphs": [
                    {
                      "position": { "x": 100, "y": 10 },
                      "bounding_box": { "x_position": 95, "y_position": 5, "width": 10, "height": 10 },
                      "codepoint": "\uE0A4",
                      "source_reference": {
                        "instrument_id": "violin-1",
                        "staff_index": 0,
                        "voice_index": 0,
                        "event_index": 0
                      }
                    },
                    {
                      "position": { "x": 150, "y": 15 },
                      "bounding_box": { "x_position": 145, "y_position": 10, "width": 10, "height": 10 },
                      "codepoint": "\uE0A4",
                      "source_reference": {
                        "instrument_id": "violin-1",
                        "staff_index": 0,
                        "voice_index": 0,
                        "event_index": 1
                      }
                    },
                    {
                      "position": { "x": 200, "y": 5 },
                      "bounding_box": { "x_position": 195, "y_position": 0, "width": 10, "height": 10 },
                      "codepoint": "\uE0A4",
                      "source_reference": {
                        "instrument_id": "violin-1",
                        "staff_index": 0,
                        "voice_index": 0,
                        "event_index": 2
                      }
                    },
                    {
                      "position": { "x": 250, "y": 10 },
                      "bounding_box": { "x_position": 245, "y_position": 5, "width": 10, "height": 10 },
                      "codepoint": "\uE0A4",
                      "source_reference": {
                        "instrument_id": "violin-1",
                        "staff_index": 0,
                        "voice_index": 0,
                        "event_index": 3
                      }
                    }
                  ],
                  "font_family": "Bravura",
                  "font_size": 40.0,
                  "color": { "r": 0, "g": 0, "b": 0, "a": 255 },
                  "opacity": 1.0
                }
              ],
              "structural_glyphs": [
                {
                  "position": { "x": 20, "y": 10 },
                  "bounding_box": { "x_position": 15, "y_position": -10, "width": 20, "height": 40 },
                  "codepoint": "\uE050",
                  "source_reference": {
                    "instrument_id": "violin-1",
                    "staff_index": 0,
                    "voice_index": 0,
                    "event_index": 0
                  }
                }
              ]
            }
          ],
          "bracket_type": "None"
        }
      ],
      "tick_range": { "start_tick": 0, "end_tick": 3840 }
    },
    {
      "index": 1,
      "bounding_box": {
        "x_position": 0,
        "y_position": 220,
        "width": 1200,
        "height": 200
      },
      "staff_groups": [
        {
          "instrument_id": "violin-1",
          "staves": [
            {
              "staff_lines": [
                { "y_position": 0, "start_x": 0, "end_x": 1200 },
                { "y_position": 5, "start_x": 0, "end_x": 1200 },
                { "y_position": 10, "start_x": 0, "end_x": 1200 },
                { "y_position": 15, "start_x": 0, "end_x": 1200 },
                { "y_position": 20, "start_x": 0, "end_x": 1200 }
              ],
              "glyph_runs": [
                {
                  "glyphs": [
                    {
                      "position": { "x": 100, "y": 15 },
                      "bounding_box": { "x_position": 95, "y_position": 10, "width": 10, "height": 10 },
                      "codepoint": "\uE0A4",
                      "source_reference": {
                        "instrument_id": "violin-1",
                        "staff_index": 0,
                        "voice_index": 0,
                        "event_index": 4
                      }
                    },
                    {
                      "position": { "x": 150, "y": 10 },
                      "bounding_box": { "x_position": 145, "y_position": 5, "width": 10, "height": 10 },
                      "codepoint": "\uE0A4",
                      "source_reference": {
                        "instrument_id": "violin-1",
                        "staff_index": 0,
                        "voice_index": 0,
                        "event_index": 5
                      }
                    },
                    {
                      "position": { "x": 200, "y": 5 },
                      "bounding_box": { "x_position": 195, "y_position": 0, "width": 10, "height": 10 },
                      "codepoint": "\uE0A4",
                      "source_reference": {
                        "instrument_id": "violin-1",
                        "staff_index": 0,
                        "voice_index": 0,
                        "event_index": 6
                      }
                    }
                  ],
                  "font_family": "Bravura",
                  "font_size": 40.0,
                  "color": { "r": 0, "g": 0, "b": 0, "a": 255 },
                  "opacity": 1.0
                }
              ],
              "structural_glyphs": []
            }
          ],
          "bracket_type": "None"
        }
      ],
      "tick_range": { "start_tick": 3840, "end_tick": 7680 }
    },
    {
      "index": 2,
      "bounding_box": {
        "x_position": 0,
        "y_position": 440,
        "width": 1200,
        "height": 200
      },
      "staff_groups": [
        {
          "instrument_id": "violin-1",
          "staves": [
            {
              "staff_lines": [
                { "y_position": 0, "start_x": 0, "end_x": 1200 },
                { "y_position": 5, "start_x": 0, "end_x": 1200 },
                { "y_position": 10, "start_x": 0, "end_x": 1200 },
                { "y_position": 15, "start_x": 0, "end_x": 1200 },
                { "y_position": 20, "start_x": 0, "end_x": 1200 }
              ],
              "glyph_runs": [
                {
                  "glyphs": [
                    {
                      "position": { "x": 100, "y": 10 },
                      "bounding_box": { "x_position": 95, "y_position": 5, "width": 10, "height": 10 },
                      "codepoint": "\uE0A4",
                      "source_reference": {
                        "instrument_id": "violin-1",
                        "staff_index": 0,
                        "voice_index": 0,
                        "event_index": 7
                      }
                    },
                    {
                      "position": { "x": 150, "y": 15 },
                      "bounding_box": { "x_position": 145, "y_position": 10, "width": 10, "height": 10 },
                      "codepoint": "\uE0A4",
                      "source_reference": {
                        "instrument_id": "violin-1",
                        "staff_index": 0,
                        "voice_index": 0,
                        "event_index": 8
                      }
                    },
                    {
                      "position": { "x": 200, "y": 20 },
                      "bounding_box": { "x_position": 195, "y_position": 15, "width": 10, "height": 10 },
                      "codepoint": "\uE0A4",
                      "source_reference": {
                        "instrument_id": "violin-1",
                        "staff_index": 0,
                        "voice_index": 0,
                        "event_index": 9
                      }
                    }
                  ],
                  "font_family": "Bravura",
                  "font_size": 40.0,
                  "color": { "r": 0, "g": 0, "b": 0, "a": 255 },
                  "opacity": 1.0
                }
              ],
              "structural_glyphs": []
            }
          ],
          "bracket_type": "None"
        }
      ],
      "tick_range": { "start_tick": 7680, "end_tick": 9600 }
    }
  ],
  "total_width": 1200,
  "total_height": 660,
  "units_per_space": 20.0
}
